Object Type,Object Name,Object Description,Property Type,Event Property Name,Property Description
Event,Contacts - Segment Created,User created a new custom contact segment.,Property Name,filters,Object of active filter key-value pairs that define the segment audience
Event,Contacts - Segment Updated,User modified an existing segment's filters.,Property Name,filters,Object of active filter key-value pairs that define the segment audience
Event,Contacts - Segment Deleted,User deleted a custom segment.,,,
Event,Contacts - Segment Viewed,User selected a segment to view in the contacts section.,Property Name,segment,Display name of the segment the user selected to view
,,,Property Name,type,"Context-dependent: outreach channel, voter file type, download format, or template type"
Event,Contacts - Column Edited,User edited the visible columns in the contacts table.,,,
Event,Voter Data: Click Need Help,User clicked Need Help on the voter records page.,,,
Event,Voter Data - Need Help: Exit modal,User closed the help modal without submitting.,,,
Event,Voter Data - Need Help: Select Voter File type,User selected which type of voter file they need help with.,Property Name,type,"Context-dependent: outreach channel, voter file type, download format, or template type"
Event,Voter Data - Need Help: Submit,User submitted the Need Help request form.,Property Name,type,"Context-dependent: outreach channel, voter file type, download format, or template type"
,,,Property Name,hasMessage,Whether the user included a free-text message in their help request (true/false)
Event,Voter Data: Click Create Custom Voter File,User clicked to start creating a custom voter file.,Property Name,position,Identifies which Create Custom Voter File button on the page was clicked
Event,Voter Data - Custom Voter File: Exit modal,User exited the custom voter file creation modal.,,,
Event,Voter Data - Custom Voter File: Select Channel,User selected the distribution channel for the custom voter file.,Property Name,channel,Distribution channel for voter outreach or voter file creation
Event,Voter Data - Custom Voter File: Select Purpose,User selected the campaign purpose for the custom voter file.,Property Name,purpose,Campaign purpose the user selected for the custom voter file
Event,Voter Data - Custom Voter File: Click Next,User advanced to the next step in the custom voter file flow.,,,
Event,Voter Data - Custom Voter File - Audience: Check Audience,User selected an audience type filter.,,,
Event,Voter Data - Custom Voter File - Audience: Check Political Party,User applied a political party filter.,,,
Event,Voter Data - Custom Voter File - Audience: Check Age,User applied an age range filter.,,,
Event,Voter Data - Custom Voter File - Audience: Check Gender,User applied a gender filter.,,,
Event,Voter Data - Custom Voter File - Audience: Click Back,User went back in the audience selection step.,,,
Event,Voter Data - Custom Voter File: Click Create,User submitted the custom voter file creation with a filename.,Property Name,fileName,Name the user gave to their custom voter file
Event,Voter Data: Click Detail View,User clicked to open a specific voter file's detail page.,Property Name,type,"Context-dependent: outreach channel, voter file type, download format, or template type"
,,,Property Name,file,Name of the voter file being downloaded or viewed
,,,Property Name,isCustom,Whether this is a user-created custom file (true) or a standard platform file (false)
Event,Voter Data - File Detail: Click Back,User navigated back from a voter file detail page.,,,
Event,Voter Data - File Detail: Click Download CSV,User initiated a CSV download of a voter file.,Property Name,type,"Context-dependent: outreach channel, voter file type, download format, or template type"
,,,Property Name,file,Name of the voter file being downloaded or viewed
Event,Voter Data - File Detail: Click View Audience Filters,User clicked to see the audience filters on a custom file.,,,
Event,Voter Data - File Detail: Click Custom File Info Icon,User clicked the info icon on a custom voter file.,,,
Event,Voter Data - File Detail - Learn & Take Action: Click Write Script,User clicked Write Script in the take-action section of the voter file detail page.,,,
Event,Voter Data - File Detail - Learn & Take Action: Click Read More,User clicked Read More in the take-action section of the voter file detail page.,,,
Event,Voter Data - File Detail - Learn & Take Action: Click Schedule,User clicked Schedule Today to set up a text campaign from the voter file detail page.,Property Name,type,"Context-dependent: outreach channel, voter file type, download format, or template type"
Event,Voter Data - File Detail - Recommended Partners: Click Read More,User clicked Read More on a recommended vendor card.,,,
Event,Download Voter File attempt,A voter file download was initiated.,Property Name,type,"Context-dependent: outreach channel, voter file type, download format, or template type"
Event,Download Voter File Success,Voter file was downloaded successfully.,Property Name,type,"Context-dependent: outreach channel, voter file type, download format, or template type"
Event,Download Voter File Failure,Voter file download failed.,Property Name,type,"Context-dependent: outreach channel, voter file type, download format, or template type"
,,,Property Name,slug,URL slug identifier for the content document
Event,Profile - Campaign Details: Click Save,User saved changes in the campaign details section.,,,
Event,Profile - Office Details: Click Edit,User clicked to edit their office details.,,,
Event,Profile - Office Details: Click Save,User saved updated office details.,,,
Event,Profile - Running Against: Click Add New,User clicked to add a new opponent.,,,
Event,Profile - Running Against: Submit Add New,User saved a new opponent entry.,,,
Event,Profile - Running Against: Cancel Add New,User cancelled adding a new opponent.,,,
Event,Profile - Running Against: Click Edit,User clicked to edit an existing opponent entry.,,,
Event,Profile - Running Against: Submit Edit,User saved edits to an opponent entry.,,,
Event,Profile - Running Against: Cancel Edit,User cancelled editing an opponent entry.,,,
Event,Profile - Running Against: Click Delete,User clicked to delete an opponent.,,,
Event,Profile - Running Against: Click Save,User clicked Save on the running against section.,,,
Event,Profile - Why Section: Click Save,User saved the Why I'm Running section.,,,
Event,Profile - Fun Fact: Click Save,User saved a fun fact about themselves.,,,
Event,Profile - Top Issues: Click Finish Entering Issues,User clicked the button to finish adding issues and move to the questions flow.,,,
Event,Profile - Top Issues: Click Edit,User clicked to edit an issue position.,,,
Event,Profile - Top Issues: Submit Edit,User saved changes to an issue position.,,,
Event,Profile - Top Issues: Cancel Edit,User cancelled editing an issue.,,,
Event,Profile - Top Issues: Click Delete,User clicked to delete an issue.,,,
Event,Profile - Top Issues: Submit Delete,User confirmed issue deletion.,,,
Event,Profile - Top Issues: Cancel Delete,User cancelled the issue deletion.,,,
Event,Settings - Personal Info: Click Upload,User clicked to upload a new profile photo.,,,
Event,Settings - Personal Info: Click Save,"User saved their personal info including name, phone, and zip.",,,
Event,Settings - Account Settings: Click Upgrade,User clicked Upgrade Plan in account settings.,,,
Event,Settings - Account Settings: Click Send Email,User clicked the email support link in account settings.,,,
Event,Settings - Account Settings: Click Manage Pro Subscription,User opened the Stripe billing portal to manage their subscription.,,,
Event,Settings - Notifications: Toggle Email,User toggled an email notification preference on or off.,Property Name,email,User's email address
,,,Property Name,enabled,Whether the notification type was toggled on (true) or off (false)
Event,Settings - Password: Click Save,User submitted a password change request.,,,
Event,Settings - Delete Account: Click Delete,"User clicked the Delete Account button, opening the confirmation dialog.",,,
Event,Settings - Delete Account: Submit Delete,User confirmed account deletion in the dialog.,,,
Event,Settings - Delete Account: Cancel Delete,User cancelled account deletion in the dialog.,,,
Event,Account - Pro Subscription Canceled,Detected on page load when a Pro subscription has an upcoming scheduled cancellation date.,Property Name,cancellationDate,Date when the Pro subscription is scheduled to be canceled
Event,Candidacy - Did You Win Modal Viewed,The Did You Win election result modal was displayed to the user.,,,
Event,Candidacy - Did You Win Modal Completed,User submitted their election outcome via the Did You Win modal.,Property Name,status,Current status of the poll or election result reported by the user
Event,Candidacy - Campaign Completed,User reported a primary election result.,Property Name,winner,Whether the candidate won the election (true/false)
,,,Property Name,officeElectionDate,Date of the election for the selected office
,,,Property Name,primary,Always true; indicates this is a primary election result rather than a general election
Event,Candidate Website - Started,User created their first website and entered the build flow.,,,
Event,Candidate Website - Continued,User returned to finish building a draft website.,,,
Event,Candidate Website - Published,User published their website for the first time. CAUTION: Used in HubSpot workflow 1739355978. Do not rename.,,,
Event,Candidate Website - Unpublished,User unpublished their candidate website.,,,
Event,Candidate Website - Edited,User saved changes to an already-published website.,,,
Event,Candidate Website - Started domain selection,User clicked to navigate to the domain selection page.,,,
Event,Candidate Website - Selected domain,User selected a custom domain from the search results.,Property Name,domainSearchedFor,Domain name the user searched for during domain selection
,,,Property Name,domainSelected,Domain name the user selected to purchase
,,,Property Name,priceOfSelectedDomain,Price of the selected domain in dollars (null if unavailable)
Event,Candidate Website - Purchased domain,User completed domain purchase. CAUTION: Used in HubSpot workflow 1739356013. Do not rename.,Property Name,domainSelected,Domain name the user selected to purchase
,,,Property Name,priceOfSelectedDomain,Price of the selected domain in dollars (null if unavailable)
Event,question_complete,User completed the campaign Q&A questionnaire.,Property Name,complete,Always true; confirms the campaign Q&A questionnaire was completed
