Category,Event Name,Properties,HubSpot Integration,Description
Candidacy / Election,Candidacy - Campaign Completed,"winner (bool), officeElectionDate, primary: true",No,User reported a primary election result.
Candidate Website,Candidate Website - Started,,No,User created their first website and entered the build flow.
Candidate Website,Candidate Website - Continued,,No,User returned to finish a draft website.
Candidate Website,Candidate Website - Published,,YES - HubSpot workflow 1739355978,User published their website for the first time.
Candidate Website,Candidate Website - Unpublished,,No,User unpublished their website.
Candidate Website,Candidate Website - Edited,,No,User saved changes to an already-published website.
Candidate Website,Candidate Website - Started domain selection,,No,User clicked to navigate to the domain selection page.
Candidate Website,Candidate Website - Selected domain,"domainSearchedFor, domainSelected, priceOfSelectedDomain",No,User selected a custom domain from search results.
Candidate Website,Candidate Website - Purchased domain,"domainSelected, priceOfSelectedDomain",YES - HubSpot workflow 1739356013,User completed domain purchase.
Misc / One-offs,question_complete,complete: true,No,User completed the campaign Q&A questionnaire.
